country,iso,gdp,population,year,tariff_f,duty_f,quota_f,voluntary_restraint_f,subsidy_f,dumping_f,license_f,rules-of-origin_f,safeguard_f,tax_f,preferential_f,regional_f,bound_f,applied_f,trademark_f,intellectual_property_f,copyright_f,countervailing_f,unfair_f,fair_trade_f,trade_facilitation_f,tariff_lf,duty_lf,quota_lf,voluntary_restraint_lf,subsidy_lf,dumping_lf,license_lf,rules-of-origin_lf,safeguard_lf,tax_lf,preferential_lf,regional_lf,bound_lf,applied_lf,trademark_lf,intellectual_property_lf,copyright_lf,countervailing_lf,unfair_lf,fair_trade_lf,trade_facilitation_lf,section_number,section_name,words,paragraphs,text
belize,BLZ,1765256400.0,366954.0,2017,0,1,0,0,5,0,0,0,0,1,0,0,0,0,0,0,0,1,0,0,0,0,1,0,0,5,0,0,0,0,1,0,0,0,0,0,0,0,1,0,0,0,3.1.109,duties and taxes,217,3,"['3.2.4  Duty and tax concessions', '3.78.  Belize  notified  the  WTO  in  October  2016  that  it  has  made  no  changes  to  the  investment programmes which provide for the grant of prohibited subsidies:', '-', '-', '-', 'programme under the Fiscal Incentives Act (Cap. 54);', 'programme under the Export Processing Zone Act (Cap. 280);', 'programme under the Free Zones Act (Cap. 278).42', '3.79.  As  these  programmes  involve  prohibited  subsidies  under  Article  3  of  the  Agreement  on Subsidies  and  Countervailing  Measures  (SCM  Agreement)  of  the  WTO,  Belize  requested  and  was granted  by  the  SCM  Committee  annual  extensions  of  the  transition  period  for  the  elimination  of export  subsidies  under  Article  27.4  of  the  SCM  Agreement.  Pursuant  to  the  General  Council decision adopted in 2007, export subsidies should have been phased out by 31 December 2015.43', '3.80.  The  Government  developed  an  action  plan  and  established  a  Working  Group  on  WTO Compliance  comprised  of  relevant  government  ministries  and  agencies.  Belize  obtained  technical assistance from the Commonwealth Secretariat, who prepared a consultant report and tabled it to the  Government.  That  report  presented  an  assessment  to  the  three  programmes,  and  indicated the  WTO-non-compliant  provisions  of  each.  In  May  2016,  the  Cabinet  considered  and  approved recommendations  from  the  Ministry  of  Economic  Development  based  on  this  consultant  report. Subsequently, the authorities are in the process of amending the Fiscal Incentives Act and the Free Zones Act, and drafting a new bill to replace the Export Processing Zone Act.']"
congo_(DRC),COD,34998638634.0,78736153.0,2016,0,7,0,0,0,0,0,0,0,5,0,0,0,0,0,0,0,0,0,0,0,0,7,0,0,0,0,0,0,0,6,0,0,0,0,0,0,0,0,0,0,0,3.1.109,duties and taxes,672,8,"['3.1.6  Duty and tax concessions', '3.67.  The  DRC  grants  various  concessions  (total  or  partial  relief/exemptions)  for  imports  and exports. However, goods eligible for concessions are subject to the administrative fee of 2% on the c.i.f.  value  at  importation.  Exports  of  agricultural  products  are  exempt,  but  subject  to  a compensatory fee of 0.25% f.o.b. In the mining sector, tradable goods are  subject to a  fee and charges of 1% f.o.b. for services rendered.', '3.68.  The aim of the main concessions is to offer incentives for production in certain branches (in particular, agriculture and mining) or to encourage exports, job creation or the establishment of businesses inside the country.', '3.69.  The relief and exemptions from customs duties and taxes are incorporated, as appropriate, in  the  DRC\'s  customs  legislation,  which  also  takes  suspensive  and  economic  procedures  into account (Articles 156a and 174 of the Customs Code), as well as specific regimes for investment in free  zones  and  special  economic  zones;  the  Tax  Code;  the  Investment  Code  (Section  2.4);  the Forest  Code  (Section  4.2);  mining  agreements  and  the  Mining  Code  (Section  4.3);  as  well  as petroleum agreements and the Hydrocarbons Code (Section 4.3). Exemptions from customs duty are  also  granted  to  goods  imported  by  the  State,  foreign  NGOs,  diplomatic  missions  and international  organizations.  Other  exemptions  are  accorded  to  ""large  enterprises""  under  their particular  establishment  agreements  and  also  in  connection  with  multilateral  or  bilateral conventions and agreements.', '3.70.  Temporary admission with total relief from import duties is granted for goods provisionally introduced  into  Congolese  territory.  The  time  limit  for  re-exportation  may  be  extended  if,  for special reasons beyond the control of the beneficiary, it cannot be met. Requests for an extension must state the reasons and be submitted in writing before the original deadline expires.', '3.71.  Goods  in  transit  are  exempt  from  import,  consumption  and  export  duties  and  taxes. However,  security  corresponding  to  125%  of  the  duty  has  to  be  paid  in  order  to  guarantee  the payment of any duties or fines that may be owing.', '3.72.  The  law  also  incorporates  exemptions  from  VAT  (Articles  15  to  19).29  Moreover,  the collection of value added tax on imports of goods by petroleum producing enterprises and mining enterprises operating under a contractual regime has also been suspended until further notice.30', ""3.73.  During the period 2010-2015, the total value of the exemptions granted annually amounted to between 7 and 11% of the country's global revenue and about 30% of State customs revenue (Section 3.1.5.1, Table 3.1), which deprived the State of considerable resources for implementing its  various  programmes.  The  scale  of  the  loss  of  revenue  resulting  from  all  these  exemptions (Table  3.4),  which  has  increased  considerably  and  for  some  items  more  than  tripled  since  the first TPR, suggests that the existing system of taxation is not well adapted to the structure of the economy."", 'Kinshasa: July 2014, Section 3 on exemptions.', '29 Ministry of Finance, Directorate-General of Taxation (2014). Tax Code, updated 15 July 2014,', '30 Ministerial Order No. 072 of 30 December 2011 on provisional measures to suspend the collection of value added tax at importation on goods imported by petroleum producing enterprises and mining enterprises operating under a contractual regime.', '\x0cCDF', 'million 129,921', '14,354 0', '27,914 14,498 73,155 0 90,826', '8,162 12,904', '15,111', '3,106', '2012 % of total', '% of total revenue', 'CDF', 'million 3.5  252,546', '0.4 0.0', '9,190', '17,945 0.7 0.4 14,386 1.9  211,026 0.0 0 2.4  150,604', '0.2 0.3', '4,414 15,136', '0.4', '0.1', '9,714', '2,789', '49.8', '5.5 0.0', '10.7 5.6 28.1 0.0 34.8', '3.1 4.9', '5.8', '1.2', '2013 % of total', '% of total', 'revenue 6.1', '0.2', '0.4 0.3 5.1 0.0 3.7', '0.1 0.4', '0.2', '0.1', '57.9', '2.1', '4.1 3.3 48.4 0.0 34.5', '1.0 3.5', '2.2', '0.6', 'CDF', 'million', '2014 % of total', '134,935', '31.9', '10,628', '61,672 6,586 54,655 1,394 221,479', '10,167 17,101', '8,119', '30,588', '2.5', '14.6 1.6 12.9 0.3 52.3', '2.4 4.0', '1.9', '7.2', '711 260,741', '0.3 100.0', '0.0 765 6.9  435,968', '0.2 100.0', '0.0 10.6', '688 423,078', '0.2 100.0', '% of total', 'revenue n.a.', 'n.a.  n.a. n.a. n.a. n.a. n.a. n.a. n.a.', 'n.a. n.a. n.a. n.a.', 'WT/TPR/S/339 • Democratic Republic of the Congo', '- 48 -', '3.74.  The  main  beneficiaries  from  exemptions  at  the  customs  cordon  have  been  enterprises benefiting  from  concessions  under  various  codes  and  agreements,  particularly  those  of  the Mining Code, followed by institutions that enjoy diplomatic privileges and the like (Chart 3.4).', 'Table 3.4 Breakdown of loss of revenue due to exemptions, 2012-2014 (CDF million and %)', 'Investment Investment Code', 'General regime Contractual regime', 'Special agreements', 'Petroleum producers Mining agreements Mining Code Other investments', 'Diplomatic privileges and the like Cooperation projects Philanthropic organizations Externally financed government procurement Exempt by way of derogation Other laws and regulations  Removals Total', 'Not available.', 'n.a. Source:  WTO Secretariat calculations, based on data provided by the authorities.', '\x0cWT/TPR/S/339 • Democratic Republic of the Congo', '- 49 -', 'Chart 3.4 Breakdown of loss of revenue due to exemptions, 2010-2014', '(CDF billion)', '500', '450', '400', '350', '300', '250', '200', '150', '100', '50', '0', '2012', '2013', '2010', '2014', '2011I. InvestmentIII. Cooperation projectsV. Externally financed government procurementVII. Other laws and regulations', '(% customs and excise revenue)30.0', '25.0', '20.0', '15.0', '10.0', '5.0', '0.0', '2010', '2011', '2012', '2013', '2014', 'II. Diplomatic privileges and the likeIV. Philanthropic organizationsVI. Exempt by way of derogationVIII. Removals', '(CDF billion)300', 'Investment-related exemptions', '(% customs and excise revenue)', '18.0', '250', '200', '150', '100', '50', '0', '2010', '2011', '2012', '2013', '2014', 'Investment CodePetroleum producers (Special agreements)Mining agreements (Special agreements)', '16.0', '14.0', '12.0', '10.0', '8.0', '6.0', '4.0', '2.0', '0.0', '2010', '2011', '2012', '2013', '2014', 'Mining CodeOther investments', 'Source:  WTO Secretariat estimates, based on data provided by the authorities.', '\x0cWT/TPR/S/339 • Democratic Republic of the Congo', '- 50 -']"
malaysia,MYS,296000000000.0,31187265.0,2014,0,3,0,0,0,0,0,0,0,2,0,0,0,0,0,0,0,0,0,0,0,0,3,0,0,0,0,0,0,0,2,0,0,0,0,0,0,0,0,0,0,0,3.1.109,duties and taxes,87,1,"['3.3.4  Duty and tax concessions', ""3.76.  There have been no changes to Malaysia's customs duty and sales tax drawback schemes during the review period. Raw materials and components used for manufacture of goods for export are  exempt  from  customs  duties  (section  3.2.2.5),  and  the  drawback  scheme  provides  refunds. The formula for the calculation of drawbacks varies from product to product and depends on the type  of  industries.88  No  data  on  the  amounts  refunded  or  the  value  of  exports  (by  product category) that benefited from drawback were available from the authorities.""]"
new_zealand,NZL,185000000000.0,4692700.0,2015,0,8,0,0,0,0,0,0,0,1,0,0,0,0,0,0,0,0,0,0,0,0,8,0,0,0,0,1,0,0,2,0,0,0,0,0,0,0,0,0,0,0,3.1.109,duties and taxes,229,4,"['3.3.4  Duty and tax concessions', '3.112.  Exporters may be eligible for duty drawback on import duties, excise taxes and, in certain cases GST, paid on imported goods.19 There have been no amendments to the drawback regime since the last Review. Exporters can claim a refund of duties for: goods imported into New Zealand that are later exported; goods manufactured and exported from New Zealand; imported parts used for  goods  manufactured  in  New  Zealand  and  subsequently  exported;  and  imported  materials, except fuel or plant equipment, used in the manufacture of goods in New Zealand and exported.20 Re-import  of  goods  exported  under  drawback  provisions  is  allowed  (subject  to  payment  of corresponding customs duty).', '3.113.  The  minimum  amount  of  drawback  that  can  be  claimed  for  commercial  goods  is  NZ$50. There is no minimum amount for private exporters.', '3.114.  The  amount  of  duties  refunded  under  the  drawback  scheme  stood  at  NZ$44  million  in 2013/2014, up from NZ$37 million in 2008/2009.', '17 NZ Customs Service online information. Viewed at:', 'http://www.customs.govt.nz/news/resources/factsheets/Documents/Fact%20Sheet%2034.pdf.', '18 NZ Customs Service online information. Viewed at:', 'http://www.customs.govt.nz/news/resources/factsheets/Documents/Fact%20Sheet%2004.pdf.', '19 Section 117 of the Customs and Excise Act 1996. 20 NZ customs Service online information. Viewed at:', 'http://www.customs.govt.nz/news/resources/factsheets/Documents/Fact%20Sheet%2001.pdf.', '\x0cWT/TPR/S/316 • New Zealand', '- 58 -', '3.115.  Duties may be waived for temporary imports, if the goods are re-exported or packed for export in a customs controlled area, or destroyed within 12 months from the date of importation. In  addition,  duty  remissions  are  available  for  goods  held  in  Customs  controlled  areas  (export warehouses and duty-free shops) duly licensed by the NZCS.']"
south_korea,KOR,1410000000000.0,51245707.0,2016,1,2,0,0,0,0,0,0,0,1,0,0,0,0,0,0,0,0,0,0,0,1,2,0,0,0,0,0,0,0,1,0,0,0,0,0,0,0,0,0,0,0,3.1.109,duties and taxes,76,1,"['3.3.4  Duty and tax concessions', '3.129.  Raw  materials  used  in  exports  are  exempt  from  customs  duties  (Section  3.2.3.5),  and  a customs  drawback  scheme  provides  refunds.  The  Korea  Customs  Service  operates  an  Internet drawback  system  allowing  refund  requests  to  be  filed  online;  a  real-time  electronic  treasury transfer system allows the Bank of Korea to make electronic refunds to exporters. Refunds totalled US$3.4  billion  (US$4.4 billion  in  2011)  in  2015  and  US$16.5  billion  in  years  from  2012  to  2015, equivalent to about 29% and 30% of tariff revenue, respectively.']"
