country,iso,gdp,population,year,tariff_f,duty_f,quota_f,voluntary_restraint_f,subsidy_f,dumping_f,license_f,rules-of-origin_f,safeguard_f,tax_f,preferential_f,regional_f,bound_f,applied_f,trademark_f,intellectual_property_f,copyright_f,countervailing_f,unfair_f,fair_trade_f,trade_facilitation_f,tariff_lf,duty_lf,quota_lf,voluntary_restraint_lf,subsidy_lf,dumping_lf,license_lf,rules-of-origin_lf,safeguard_lf,tax_lf,preferential_lf,regional_lf,bound_lf,applied_lf,trademark_lf,intellectual_property_lf,copyright_lf,countervailing_lf,unfair_lf,fair_trade_lf,trade_facilitation_lf,section_number,section_name,words,paragraphs,text
india,IND,2260000000000.0,1324171354.0,2015,6,1,0,0,0,0,0,0,0,1,0,0,0,1,0,0,0,0,0,0,0,6,1,0,0,0,0,0,0,0,1,0,0,0,0,0,0,0,0,0,0,0,3.1.119,customs valuation,578,6,"['3.1.2  Customs valuation', '3.11.  Since 2011, there has been no major change in customs valuation on imports adopted by India.  Its  main  legislation  regulating  customs  valuation  includes  the  Customs  Act  1962 (Section 14), as amended, and the Customs Valuation (Determination of Price of Imported Goods) Rules 2007. Under the Act, it is stipulated that determination of value of imports should be based on the transaction value, which is defined as the price actually paid or payable for the goods when sold  for  export  to  India,  including  any  amount  paid  or  payable  for  costs  and  services (e.g. commissions  and  brokerage,  royalties  and  licence  fees,  transport  and  insurance  costs,  and handling  charges)8.  A  landing  charge  (for  loading,  unloading,  and  handling)  of  1%  of  the c.i.f. value is added to the c.i.f. value.9', '3.12.  Nonetheless,  the  Central  Board  of  Excise  and  Customs  is  authorized  by  notification  in  the Gazette of India to fix reference prices (""tariff values"") for any type of imported (exported) goods, in  accordance  with  Section  14(2)  of  the  Customs  Act  1962.  On  16  January  2012,  a  notification concerning  the  introduction  of  reference  prices  to  imports  of  gold  and  silver  was  issued;  the changes entered into force on 17 January 2012.10 On 25 June 2013, areca nuts were made subject to reference prices.11 The authorities state that tariff values are revised every two weeks and are adjusted to align with international market prices (Table 3.1).', 'Table 3.1 Tariff values (reference prices), 2009-14', 'HS code', 'Description', '1511.10.00 1511.90.10 1511.90.90 1511.10.00 1511.90.20 1511.90.90 1507.10.00 7404.00.22 1207.91.00 71 or 98', 'Palm oil (crude) Palm oil (RBD) Palm oil (others) Palmolein (crude) Palmolein (RBD) Palmolein (others) Soyabean oil (crude) Brass scrap (all grades) Poppy seeds Gold (US$ per 10 grams)', 'Tariff value (US$/tonne)', '2009 447 476 462 481 484 483 580 3,476 3,144 n.a.', '2010 447 476 462 481 484 483 580 4,320 3,445 n.a.', '2011 447 476 462 481 484 483 580 3,993 1,970 n.a.', '2012 447 476 462 481 835 483 580 4,090 4,870 539', '2013 892 922 907 925 928 927 958 3,940 3,195 392', '2014 669 696 683 700 703 702 843 3,697 3,747 392', '6 WTO document WT/TPR/M/249/Add.1, 14 October 2011. 7 WTO (2011). 8 Transport cost includes the ship demurrage charges on charted vessels and barge charges. 9 The landing charges are applied at the same rate regardless of the mode of transport. WTO document', 'WT/TPR/M/249/Add.1, 14 October 2011.', '10 Customs (non-tariff) Notification No. 3/2012, 16 January 2012. 11 Customs (non-tariff) Notification No. 67/2013, 25 June 2013.', '\x0cHS code', 'Description', 'Silver (US$ per kilogram) Areca nuts', '71 or 98 080280', 'n.a. Note:', 'WT/TPR/S/313 • India', '- 37 -', 'Tariff value (US$/tonne)', '2009 n.a. n.a.', '2010 n.a. n.a.', '2011 n.a. n.a.', '2012 979 n.a.', '2013 638  1,816', '2014 519 2,183', 'Not applicable. ""Tariff values"" for poppy seeds were introduced through Customs (non-tariff) Notification No. 116/2007, 3 December 2007. Reference prices are for end-year.', 'Source:  Customs (non-tariff) Notifications Nos. 188/2009, 31 December 2009; 03/2010, 31 December 2010;', '89/2011, 30 December 2011; 115/2012, 31 December 2012; 134/2013, 31 December 2013; and 117/2014, 31 December 2014.', '3.13.  The  transaction  value  is  not  used  if  ""reasonable  doubt""  arises  on  the  accuracy  of  the declared value, or in the event, inter alia, where: (1) there are certain restrictions on disposition or use  of  the  goods  by  the  buyer;  (2)  the  sale  or  price  is  subject  to  condition  or  consideration  for which a value cannot be determined; (3) part of the proceeds of any resale, disposal or use of the goods by buyer will accrue directly or indirectly to seller; or (4) the buyer and seller are related.12 If  the  transaction  value  is  not  used,  the  value  is  determined  according  to  other  methods,  in sequential  order:  transaction  value  of  identical  goods;  transaction  value  of  similar  goods; deductive value; computed value; and residual method.', '3.14.  The  transaction  value  is  also  generally  used  to  assess  the  additional  duty  on  imports. Nonetheless,  for  imports  of  some  packaged  goods,  which,  if  produced  domestically,  would  be subject  to  a  maximum  retail  price  (MRP),  the  value  of  the  goods  is  determined  using  the  MRP declared on the package minus an ""abatement"" for like domestic goods.13', '3.15.  India maintains, in the WTO, the special and differential treatment provisions invoked under the Tokyo Round Agreement14; it continues to maintain a reservation concerning the reversal of the sequential order of Articles 5 and 6, and a reservation to apply Article 5.2 whether or not the importer so requests.15', '3.16.  Importers may file an appeal against customs decisions on valuation matters to the Appeals Commissioner  or  the  Customs,  Excise,  and  Service  Tax  Appellate  Tribunal  (Customs  Act  1962, Sections 128-129).16']"
japan,JPN,4940000000000.0,126994511.0,2017,0,0,0,0,0,0,0,0,0,0,0,0,0,0,0,0,0,0,0,0,0,0,0,0,0,0,0,0,0,0,0,0,0,0,0,0,0,0,0,0,0,0,3.1.119,customs valuation,159,2,"['3.1.2  Customs valuation', ""3.17.  Japan's  customs  valuation  regime  has  not  changed  during  the  review  period. All  importers must file a customs declaration once goods have entered into a hozei area; this may now be done without  entry  of  goods  into  the  bonded  area  under  certain  conditions,  such  as  an  authorized importer  presenting  an  import  declaration  using  the  electronic  data  processing  system.  The customs value of imported goods is determined according to their c.i.f. price (in principle based on the transaction value of the imported goods)."", ""3.18.  Complaints  against  Customs'  decisions  may  be  made  to  the  Director-General  of  Customs within  two  months  of  the  decision.  Further  appeals  may  be  lodged  with  the  Minister  of  Finance"", '13 SAFE Framework of Standards, World Customs Organization online information. Viewed at:', 'http://www.wcoomd.org/en/topics/facilitation/instrument-and-tools/tools/~/media/2B9F7D493314432BA42BC8498D3B73CB.ashx.', '\x0cWT/TPR/S/351 • Japan', '- 32 -', ""within  one  month  of  the  decision  by  the  Director-General  of  Customs.  A  lawsuit  may  be  filed against  the  Minister's  decision  within  six  months  of  such  decision.  The  authorities  indicate  that in 2015 there were seven complaints, one appeal, and one lawsuit was filed.""]"
kyrgyz_republic,KGZ,6551287938.0,6082700.0,2013,0,0,0,0,0,0,0,0,0,0,0,0,0,0,0,0,0,0,0,0,0,0,0,0,0,0,0,0,0,0,0,0,0,0,0,0,0,0,0,0,0,0,3.1.119,customs valuation,2,0,['3.1.2  Customs valuation']
liechtenstein_switzerland,CHE,660000000000.0,8372098.0,2017,0,4,0,0,0,0,0,0,0,0,0,0,0,0,0,0,0,0,0,0,0,1,4,0,0,0,0,0,0,0,0,0,0,0,0,0,0,0,0,0,0,0,3.1.119,customs valuation,77,1,"['3.1.2  Customs valuation', '3.10.  All  tariffs  in  Switzerland  and  Liechtenstein  are  specific  duties  and  do  not  need  a  customs valuation as the gross weight (weight of goods plus packaging) is used to calculate the duty. For VAT and some other taxes, such as the automobile duty, which are collected at the border and are based  on  value,  the  invoice  value  is  used.  Compared  to  VAT  collected  on  imports,  import  duties represent a relatively small proportion of total revenues collected by the FCA (Chart 1.3).']"
maldives,MDV,3591112751.0,417492.0,2016,0,1,0,0,0,0,0,0,0,0,0,0,0,0,0,0,0,0,0,0,0,0,1,0,0,0,0,0,0,0,0,0,0,0,0,0,0,0,0,0,0,0,3.1.119,customs valuation,377,5,"['3.2.2  Customs valuation', '3.18.  With the adoption of the Maldives Customs Act in 2011, valuation of goods is, in principle, determined in accordance with the principles and provisions of the WTO Agreement on  Customs Valuation. Imports are valued at their c.i.f. price, or the cost and freight charges price if the goods are not insured. The main valuation method is the transaction value of goods, and is based on the price actually paid or to be paid by the buyer. In a large majority of cases (94% of declarations processed in 2014), the value declared by the importer is accepted as the transaction value. When the declared value is rejected, the authorities adjust the value using reference prices (which are based  on  historical  information).  The  importer  may  accept  the  raised  value,  submit  additional documentation,  or  request  a  re-assessment.  The  authorities  indicated  that,  in  most  cases,  the importer submits additional documentation.', '3.19.  Appeals  against  customs  decisions  can  be  brought,  in  the  first  instance,  to  the  MCS valuation sub-committee (in the case of valuation-related complaints) or to the Appeal Committee (for any other type of appeal). If the trader is not satisfied with the decision of the appeal process, he can file a case at the judicial courts within six months of the appeal decision. In 2014 and 2015, 44 appeal cases were brought before the Appeal Committee, of which 27 were related to valuation.', '3.20.  Under-valuation (or non-declaration) is the most frequent violation. It affects high duty rate items such as cigarettes, and high value items such as mobile phones. The legislation provides for fines  ranging  from  25%  for  the  first  instance  of  offense,  to  50%  for  the  third  instance  and  any subsequent occurrence (within two years from the time of the first offence). In addition, the MCS may seize the licence of the offending person. The authorities indicated that there are few cases of smuggling. However, the smuggling of narcotics is a serious problem.', '3 WTO document G/PSI/N/1/Add.8, 28 September 1999. 4 World Bank (2015a); and World Bank (2009).', '\x0cWT/TPR/S/332 • Maldives', '- 32 -', '3.21.  Lack of proper documentation is another major challenged faced in the process of customs valuation.  The  authorities  indicated  that  informal  business  practices  are  still  prevalent  and  it  is common that importers visit the exporting countries and pay in cash.', '3.22.  Maldives has neither submitted notifications on its legislation nor replied to the checklist of issues as required by the WTO Agreement on Customs Valuation.5']"
mexico,MEX,1050000000000.0,127540423.0,2017,0,0,0,0,0,0,0,0,0,2,0,0,0,0,0,0,0,0,0,0,0,0,0,0,0,0,0,0,0,0,2,0,0,0,0,0,0,0,0,0,0,0,3.1.119,customs valuation,271,3,"['3.1.2  Customs valuation', '3.12.  The  customs  value  of  goods  is  determined  in  accordance  with  the  WTO  Agreement  on Customs Valuation and the Customs Law. In general, the transaction value is used to calculate the', '9 First Resolution amending the General Foreign Trade Rules for 2016 and annexes thereto, Glossary of', 'Definitions and Acronyms, 1, 4, 10, 21, 22, 24, 27, 28, 29, 30 and 31, published in the Official Journal of 9 May 2016.', '10 Idem.', '\x0cWT/TPR/S/352 • Mexico', '- 47 -', 'value of goods, and when this cannot be done the alternative methods of valuation set out in the WTO Agreement are used (Articles 71 and 78 of the Customs Law).', '3.13.  Where  the  documentation  establishing  the  value  is  false  or  has  been  tampered  with,  or  in the  case  of  used  goods,  the  customs  authority  may  reject  the  declared  value  and  determine  the customs  value  using  the  methods  stipulated  in  the  WTO  Agreement,  or  on  the  basis  of  its  own valuation.  According  to  the  authorities,  in  the  majority  of  cases  (70%  in  2016)  the  transaction value is used. Importers have the right to request a justification, prior to release of the goods, as to the valuation method or elements used to determine their customs value.', '3.14.  Mexico  still  uses  estimated  prices  for  the  valuation  of  certain  goods  in  order  to  avoid undervaluation  as  well  as  tax  evasion.  According  to  the  authorities,  these  prices  only  serve  as  a reference and cannot be used to determine the tax base for import taxes, and therefore the value declared by the importer is not rejected and the goods may be removed from customs. Estimated prices are used for imports of used vehicles, textiles and clothing, and footwear, regardless of the origin of the imports.11 Importers must deposit a security in order to import any goods subject to an estimated price.']"
moldova,MDA,6749515655.0,3552000.0,2015,0,0,0,0,0,0,0,0,0,0,0,0,0,0,0,0,0,0,0,0,0,0,0,0,0,0,0,0,0,0,0,0,0,0,0,0,0,0,0,0,0,0,3.1.119,customs valuation,174,3,"['3.1.2  Customs valuation', '3.9.  Customs value is primarily assessed based on the transaction value which must also reflect costs  incurred  by  the  buyer  when  appropriate  (e.g.  packing  fees,  transport  charges).  If  the transaction value method cannot be used, five methods apply in sequential order: (i) transaction value  of  identical  goods;  (ii)  transaction  value  of  similar  goods;  (iii)  deductive  value;  (iv) computed value; and (v) residual valuation (flexible and reasonable method). The legislation also stipulates the list of documents that customs can request for the purposes of establishing customs value.  Any  request  for  additional  documents  must  be  justified  by  customs.  According  to  the authorities, some 93% of declarations are valued using the transaction value.', '3.10.  Appeals  against  customs  decisions  can  be  submitted  to  the  headquarters  of  the  customs authority or directly to court. There is no obligation to first exhaust the administrative way. The bulk  of  appeals  relate  to  customs  valuation.  The  court  is  the  same  for  decisions  of  public authorities (administrative court); there is no special commercial court.', '3.11.  The  Republic  of  Moldova  does  not  have  laws  or  regulations  relating  to  pre-shipment inspection.']"
mongolia,MNG,11160356498.0,3027398.0,2014,1,0,0,0,0,0,0,0,0,0,0,0,0,0,0,0,0,0,0,0,1,1,0,0,0,0,0,0,0,0,0,0,0,0,0,0,0,0,0,0,0,1,3.1.119,customs valuation,143,1,"['3.1.2  Customs valuation', '3.14.  Customs valuation for imported goods is administered in accordance with the Customs Tariff Law; the c.i.f. price of imports is used as the basis for customs valuation. The primary basis for determination is the transaction value. If Customs suspects that the declared value is not correct, and if the importer cannot justify the declared import value, Customs may apply the ""deductive method"",  the  ""computed  method"",  or  the  ""fall-back  method"".  The  authorities  indicate  that  the transaction value applies to more than 70% of the total transaction value of imports. According to the  authorities,  based  on  the  revised  Customs  Law,  Mongolia  has  revised  the  methods  of determining the customs value of imported goods.', '4 The authorities intend to keep the balance between customs control and trade facilitation to support', 'national security, legitimate trade, and Customs Law compliance.', '5 Articles 96-110,135-139, Customs Law. 6 Chapter Ten, Customs Law. 7 Article 17.2, Customs Law.', '\x0cWT/TPR/S/297 • Mongolia', '- 25 -']"
morocco,MAR,101000000000.0,35276786.0,2015,0,0,0,0,0,0,0,0,0,0,0,0,0,0,0,0,0,0,1,0,0,0,0,0,0,0,0,0,0,0,0,0,0,0,0,0,0,0,0,1,0,0,3.1.119,customs valuation,386,3,"['3.1.2  Customs valuation', '3.16.  Morocco  confirms  that  it  has  been  applying  the  WTO  Customs  Valuation  Agreement  since 5 October 1998  and  the  provisions  in  Article 6  on  the  method  for  calculating  value  have  been incorporated  into  domestic  legislation  (Finance  Law  No. 45-02  of  2003).12  If  there  is  any  doubt concerning the value, the customs has to invite the importer or the declarant in writing to present the additional supporting documents proving the value declared within a period of one month.13 If no reply is received within this period or if the supporting documents do not suffice, the customs rejects  the  value  declared  and  adjusts  it  using  the  methods  prescribed  in  the  WTO  Customs Valuation Agreement.', '3.17.  Since  2010,  the  General  Confederation  of  Moroccan  Enterprises  (CGEM),  the  DGI  and  the Foreign Exchange Board have joined together to set up an ad hoc public/private committee with the aim of drawing up an action plan to combat under-invoicing. A technical committee to examine short-,  medium-  and  long-term  action  and  a  monitoring  committee  to  analyse  foreign  trade databases  and  facilitate  the  preparation  of  indicators  for  estimating  value  have  also  been established.', '3.18.  A  list  of  ""sensitive""  products  that  could  give  rise  to  trade  fraud  was  drawn  up  in  2004. Among the products listed are: products for which it has been found that the values declared do not  correspond  to  production  costs  or  have  been  substantially  reduced;  products  which  present various  risks  of  unfair  competition  with  identical  imports;  and  products  for  which  the  import statistics  show  significant  decreases  in  the  unit  price.  This  list  is  updated  regularly  and  includes food products, cosmetic and household products, as well as clothing, footwear and spare parts for', 'and Finance No. 690.11 of 22 July 2011 (OJ No. 5987 of 17 October 2011) and No. 691.11 of 22 July 2011 (OJ No. 5985 of 10 October 2011); Circulars No. 5087/313 of 1 February 2008, No. 5142/313 of 23 February 2009, No. 5336/313 of 12 September 2012 and No. 5517/313 of 17 February 2015.', '11 Ministry of the Economy and Finance, ADII, online information, ""La douane vous propose des', 'solutions diversifiées"" in Prospectus/Mesures de simplification mises en place par la douane au profit des entreprises; viewed at: http://www.douane.gov.ma/web/guest/nos-publications.', '12 Customs Code, as amended by Finance Law No. 12-98 for the 1998-1999 financial year, and', 'WTO document G/VAL/N/1/MAR/2 of 17 February 2003.', '13 Customs and Excise Administration, Note No. 21487/231 of 23 November 2001.', '\x0cWT/TPR/S/329 • Kingdom of Morocco', '- 42 -', 'vehicles. The products thus identified are systematically subject to prior control of their value by the competent authority. According to the authorities, however, the transaction value is used for most imports.']"
nigeria,NGA,405000000000.0,185989640.0,2017,0,2,0,0,0,0,0,0,0,0,0,0,0,0,0,0,0,0,0,0,0,0,2,0,0,0,0,0,0,0,0,0,0,0,0,0,0,0,0,0,0,0,3.1.119,customs valuation,170,2,"['3.1.2  Customs valuation', '3.11.  In Nigeria, customs valuation is based on the transaction value of the imported goods in the first instance. According to the authorities, in around 80% of cases, import duties are based on the transaction  value.  If  the transaction  value  is  not  available,  then duty  is determined  based on  the transaction value of identical goods or, when a comparison with identical goods is not possible, the transaction  value  of  similar  goods  is  considered.  In  cases  where  none  of  the  above  methods  are possible,  the  following  are  considered  in  order  of  preference:  sales  value  in  Nigeria  of  identical goods;  sales  value  in  Nigeria  of  similar  goods;  computed  value;  and  lastly,  a  reasonable  value according to the customs authorities.8', '3.12.  In  some  cases,  Nigerian  Customs  finds  it  difficult  to  assess  the  valuation  for  a  certain product. For example, it notes that it is difficult to confirm invoice value with transaction value. For social reasons, the government may maintain a minimum value on certain products, such as staple foods, second-hand goods and tyres, in which case the government sets a benchmark.']"
oman,OMN,66293368010.0,4424762.0,2013,0,0,0,0,0,0,0,0,0,0,0,0,0,0,0,0,0,0,0,0,0,1,0,0,0,0,0,0,0,0,0,0,0,0,0,0,0,0,0,0,0,0,3.1.119,customs valuation,199,3,"['3.2.2  Customs valuation', '3.9.  Oman  has  notified  that,  through  Sultani  Decree  67/2003,  it  is  implementing  the  WTO Customs Valuation Agreement (CVA) on the basis of the GCC Common Customs Law and its Rules of Implementation and Explanatory Notes.3 The first basis for determining the value for customs purposes  is  the  transaction  value.  If  the  transaction  value  cannot  be  determined,  the  customs value  is  to  be  calculated  by  proceeding  through  the  basic  methods  set  by  the  CVA.  Oman  has reserved  its  rights  under  Annex  III,  paragraph 3 (concerning  reversal  of  sequential  order  of Articles 5 and 6), and paragraph 4 (to apply Article 5.2 whether or not the importer so requests).4 Tariffs are levied on the c.i.f. value of imports.', '3.10.  Oman replied to the Checklist of issues in the Committee on Customs Valuation in 2008.5', '3.11.  To  settle  customs  valuation  and  classification  disputes,  an  operator  may  appeal  to  the Directorate General of Customs under the Royal Oman Police (ROP); then to the Inspector General of  Police  and  Customs,  also  under  the  ROP;  to  the  Minister  of  Finance;  and  lastly  to  the  Omani Court  of  Arbitration.  Between  January  2008  and  June  2013,  there  were  269  disputes,  mostly related  to  valuation.  According  to  the  authorities,  between  80%  and  90%  of  the  disputes  were decided in favor of the importer.']"
pakistan,PAK,284000000000.0,193203476.0,2015,0,1,0,0,0,0,0,0,0,1,0,0,0,0,0,0,0,0,0,0,0,1,1,0,0,0,0,0,0,0,1,0,0,0,0,0,0,0,0,0,0,0,3.1.119,customs valuation,190,2,"['3.2.2  Customs valuation', ""3.12.  Located in Karachi, the Directorate General of Customs Valuation falls under the FBR which has jurisdiction over all of Pakistan. Its field offices operate in accordance with the 1969 Customs Act.  Pakistan  notified  the  WTO  in  2001  that  the  basis  for  determining  the  value  for  customs' purposes is the transaction value.6 Tariffs are levied on the c.i.f. value of goods. Pakistan has not, however, replied to the Checklist of issues in the Committee on Customs Valuation."", '3.13.  The Pakistan Customs Valuation Gateway offers information on rules and procedures as well as application forms.7 Administrative appeals against duty valuations and other customs decisions may  be  made  to  a  Customs  Internal  Review8,  and  to  the  FBR,  which  appoints  a  committee  to consider the case. Such decisions, including criminal proceedings, may be appealed to the Special Court  for  Customs,  Taxation  and  anti-smuggling,  and  subsequently  to  the  Appellate  Tribunal  on', '3 Web-Based One Customs online information. Viewed at: https://www.weboc.gov.pk/. 4 World Bank (2013a). 5 The Gazette of Pakistan, 6 April 2013.  6 WTO document G/VAL/N/1/PAK/1, 15 May 2001. 7 Pakistan Customs Valuation Gateway online information. Viewed at:', 'http://valuationgateway.fbr.gov.pk.', '8 Pakistan Customs - Post Clearance Audit Manual, Section 2.4.', '\x0cWT/TPR/S/311 • Pakistan', '- 35 -', 'Customs, Excise and Sales Tax, the provincial High Court and, in certain situations, the Supreme Court.']"
